{
  "schemaVersion": "1.0.0",
  "site": {
    "areaM2": 120,
    "region": "IN-TN",
    "sunlight": "full",
    "water": "medium"
  },
  "objectives": {
    "forestType": "mixed",
    "densityPerM2": 3
  },
  "recommendations": [
    { "speciesId": "ficus-religiosa", "qty": 40, "layer": "canopy" },
    { "speciesId": "murraya-koenigii", "qty": 30, "layer": "shrub" }
  ]
}
